{
  "schemaVersion": "1.0.0-draft",
  "task": {
    "id": "m1-mock-task",
    "intent": "social-cover",
    "locale": "zh-CN"
  },
  "brand": {
    "profile": "brands/example/brand.yaml",
    "requiredRules": []
  },
  "canvas": {
    "width": 1080,
    "height": 1440,
    "background": "#F5E9D5"
  },
  "creative": {
    "mode": "generate-background",
    "brief": "M1 协议测试，不生成真实视觉内容",
    "negativeConstraints": ["不要把 Mock 产物作为真实交付"]
  },
  "assets": [],
  "layers": [],
  "variants": [{ "id": "warm-editorial" }, { "id": "clean-modern" }],
  "quality": {
    "requiredChecks": ["artifact.complete"],
    "manualChecks": ["provider.mock"]
  },
  "output": {
    "directory": "outputs/m1-mock-task",
    "format": "png",
    "separateVariantFiles": true
  }
}
